{"contractVersion":1,"targetPackage":"gemstone-py-native","adapterModule":"gemstone_rs::py_native","scaffold":"py_native_pyo3_adapter","status":"Rust-side handoff bundle is wired into gemstone-py-native; local live smoke and publish verification have passed","artifacts":[{"name":"capabilities","path":"examples/py-native/gemstone-rs.py-native.json","schema":"schemas/gemstone-rs.py-native.schema.json","command":"gemstone-rs py-native capabilities --json","checkCommand":"gemstone-rs py-native check examples/py-native/gemstone-rs.py-native.json","purpose":"Adapter operations, value kinds, error kinds, threading policy, and OOP constants"},{"name":"samples","path":"examples/py-native/gemstone-rs.py-native-samples.json","schema":"schemas/gemstone-rs.py-native-samples.schema.json","command":"gemstone-rs py-native samples --json","checkCommand":"gemstone-rs py-native check-samples examples/py-native/gemstone-rs.py-native-samples.json","purpose":"Value and structured error payloads for Python wrapper translation tests"},{"name":"smoke","path":"examples/py-native/gemstone-rs.py-native-smoke.json","schema":"schemas/gemstone-rs.py-native-smoke.schema.json","command":"gemstone-rs py-native smoke --dry-run --json","checkCommand":"gemstone-rs py-native check-smoke examples/py-native/gemstone-rs.py-native-smoke.json","purpose":"Dependency-free adapter smoke report for CI without a live stone"},{"name":"migration","path":"","schema":"schemas/gemstone-rs.py-native-migration.schema.json","command":"gemstone-rs py-native migration --json","checkCommand":"","purpose":"Downstream wrapper status plus live-smoke and wheel-publish checklist"},{"name":"compatibility","path":"examples/py-native/gemstone-rs.py-native-compat.json","schema":"schemas/gemstone-rs.py-native-compat.schema.json","command":"gemstone-rs py-native compatibility --json","checkCommand":"gemstone-rs py-native check-compat examples/py-native/gemstone-rs.py-native-compat.json","purpose":"Python package-layer return policy and method mapping"},{"name":"conformance","path":"examples/py-native/gemstone-rs.py-native-conformance.json","schema":"schemas/gemstone-rs.py-native-conformance.schema.json","command":"gemstone-rs py-native conformance --json","checkCommand":"gemstone-rs py-native check-conformance examples/py-native/gemstone-rs.py-native-conformance.json","purpose":"PyO3 module functions, raw session methods, shim methods, fixtures, and scaffold files"}],"acceptance":[{"id":"scaffold_compiles","required":true,"verify":"python3 scripts/check_py_native_pyo3_scaffold.py"},{"id":"fixtures_current","required":true,"verify":"cargo run -p gemstone-rs-cli -- py-native check-all"},{"id":"python_return_policy_preserved","required":true,"verify":"gemstone-py sync and async test suites keep existing Session.execute()/perform() behavior"},{"id":"live_native_backend_green","required":true,"verify":"GS_RUN_LIVE=1 gemstone-py native/backend smoke through the Rust-backed PyO3 module"},{"id":"wheels_after_live_green","required":true,"verify":"gemstone-py-native 0.1.3 TestPyPI/PyPI install verification passed through the native-wheels workflow"}]}
